Nombre,Longitud,Latitud,Estado,Municipio,Parroquia,Dirección,Telefono,Correo_electrónico
Clínica Popular El Valle,-66.912869,10.460618,Distrito Capital,Libertador,El Valle,"“Calle 4, avenida Principal Los Jardines Del Valle, Distrito Capital, 1090.”",02126725506,bferraro123@hotmail.com
Clínica Popular de Catia,-66.932992,10.513965,Distrito Capital,Libertador,Sucre,"“Av. Sucre, Caracas 1030, Distrito Capital”.",04162111911,0
Clínica Popular de Caricuao,-66.962919,10.433160,Distrito Capital,Libertador,Caricuao,"“Avenida Principal De La Hacienda,Sector UD5, Caracas 1000, Distrito Capital.”",02124341529,oswaldoacosta2009@hotmail.com 
Clínica Popular El Paraíso,-66.923561,10.494129,Distrito Capital,Libertador,Paraiso,"“Avenida José Antonio Páez, Caracas 1020, Distrito Capital.”",02124811659,anmar07@gmail.com
Clínica Popular de Gramoven,-66.947375,10.523095,Distrito Capital,Libertador,Sucre,"“Caracas, Distrito Capital.”",02128704589,llugo65@hotmail.com
